1123, , vanish, 消える, During the show, the magician vanished from sight of the stage., ショーの途中、手品師は舞台上で視界から消えた。
1124, , polish, を磨く;を洗練させる, He polishes the floors of his apartment once a week., 彼は週に一度自分のマンションの床を磨く。
1125, , wipe, を拭く;を拭きとる;を消し去る, She wiped her hands with a hand towel., 彼女は手拭きタオルで手を拭いた。
1126, , sweep, （を）掃く,を一掃する,さっさと通過する, It is my job to sweep the path in front of the house every day., 毎日家の前の通路を掃くのが私の仕事だ。
1127, , mislead, を誤解させる、欺く;（人）を間違った方向に導く, The salesperson misled the customer into buying an expensive product., その販売員は客を欺いて高価な製品を買わせた。
1128, , spoil, を台無しにする;を甘やかす;だめになる, He feels the London Eye spoils the view of London., 彼はロンドンアイがロンドンの景色を台無しにしていると感じている。
1129, , compound, を悪化させる;を合成する;を混合する, His sudden illness compounded the financial problems of his company., 彼の突然の病気は彼の会社の財務問題を悪化させた。
1130, , explode, 爆発する;急増する;を論破する, If the bomb had exploded, many people would have suffered injuries., もし爆弾が爆発していたら、多くの人がけがをしていただろう。
1131, , disgust, をむかつかせる;に愛想を尽かせる, The man was disgusted by the inappropriate remark from the politician., その男性は政治家の不適切な発言にむかついた。
1132, , commute, 通勤［通学］する, If mass transit isn't available, people will commute with cars., 大量輸送機関が利用できないと、人々は車で通勤するだろう。
1133, , decorate, を装飾する, The Smiths like to decorate their house with paintings., スミス夫妻は自分たちの家を絵画で飾るのを好む。
1134, , postpone, を延期する, We have decided to postpone the meeting until Wednesday., 私たちは水曜日までに会議を延期することに決めた。
1135, , cease, をやめる;終わる, The small village ceased to exist after the last resident moved away., その小さな村は最後の住民が大挙した後なくなった。
1136, , compromise, 妥協する;を危うくする, The salesperson compromised with the buyer on the price., その販売員は価格面で買い手と妥協した。
1137, , elect, を選出する, The voters were sensible enough to elect him a member of the Diet., 有権者は賢明にも彼を国会議員に選んだ。
1138, , extract, を取り［搾り］出す;を抜粋する, A juicer is used to extract juice from fruit and vegetables., ジューサーは果物や野菜から汁を絞り出すのに使われる。
1139, , inherit, を受け継ぐ;を相続する, She inherited her musical talent from her father., 彼女は父親から音楽的才能を受け継いだ。
1140, , rear, （人・動物・植物）を育てる, This is a good place to rear young children., ここは幼い子供を育てるのに良い所である。
1141, 名詞, empathy, 感情移入、共感; She has great empathy with people in need., 彼女は困窮している人々に大いに感情移入する。
1142, , cue, 合図;手掛かり;（次の演技の）キュー, In face-to-face negotiations, we give off and receive nonverbal cues., 面と向かっての交渉では私たちは非言語的合図を出したり受けたりする。
1143, , enterprise, 企業、事業;企画;進取の気性, I work for a global enterprise selling cosmetics around the world., 私は世界中で化粧品を販売している世界的企業に勤めている。
1144, , output, 生産（高）;出力;排出（量）, The output of this product has decreased due to the factory closure., この製品の生産高は工場の閉鎖が原因で減少した。
1145, , congress, （米国などの）議会;会議, In 1894, Congress passed a law making Labor Day a federal holiday., 1894年、米国議会は「労働者の日」を連邦の祝日にする法律を通過させた。
1146, , millennium, 千年間、千年紀, Animal species have been breeding with one another for many millennia., 動物種は何千年もの間、互いに交わり繁殖してきた。
1147, , mankind, 人類, Environmental destruction threatens the future of mankind., 環境破壊は人類の未来を脅かす。
1148, , Muslim, イスラム教徒, Muslims pray in mosques on Friday, their holy day of the week., イスラム教徒は、彼らの聖なる曜日である金曜日にモスクで祈る。
1149, , estate,（動産・不動産などの）財産;私有地, The property is part of my late mother's estate., その不動産は私の亡き母の財産の一部である。
1150, 名詞, landmine, 地雷, The landmine was one of the weapons used in the Vietnam war., 地雷はベトナム戦争で使われた武器の一種だった。
1151, 名詞, caution, 用心; 警告, The are expected to do their job with extra caution., 彼らは特別に用心して自分たちの仕事をすることが求められる。
1152, 名詞, controversy, 論争, There has been controversy over revisions to the constitution., 憲法の改正に関する論争が続いてきている。
1153, 名詞, consensus, 総意; （意見の）一致, The consensus of the class is that we will run a cafe at the school festival., クラスの総意は私たちが文化祭でカフェを運営することである。
1154, , retail, 小売り, The shop sells local farm products at retail prices., その店は地元の農産物を小売価格で販売する。
1155, , fiber, 繊維（質);本質;精神力, Brown rice is rich in dietary fiber and vitamin B., 玄米は食物繊維とビタミンBが豊富である。
1156, , scent, （よい）香り;香水, Tea is sometimes combined with the scent of various flowers., 茶はさまざまな花の香りと組み合わされることがある。
1157, , beverage, （水以外の）飲み物、飲料, Some religions prohibited people from drinking alcoholic beverages., 人々にアルコール飲料を飲むことを禁じていた宗教もある。
1158, , supplement, 栄養補助剤、サプリメント;補足, He takes many supplements every day., 彼は毎日多くのサプリメントを服用する。
1159, , diabetes, 糖尿病, There is a close link between obesity and diabetes., 肥満と糖尿病との間には密接な関連がある。
1160, , province, 州、省;（the ～s）地方;分野, About one-third of the population in Canada lives in the province of Ontario., カナダの人口の約3分の1はオンタリオ州に住んでいる。
1161, , reef, （岩や砂の）礁;暗礁, Coral reefs provide us with rich fishing resources., サンゴ礁は私たちに豊かな漁業資源を提供する。
1162, , microbe, 微生物;細菌, Soil full of microbes can help plants grow strong., 微生物をたくさん含む土壌は植物が丈夫に育つのを助ける。
1163, , excess, 過剰、超過, Drinking in excess will weaken your immune system., 過度の飲酒は体の免疫系を弱めることになる。
1164, , gallery, 美術館、画廊;観客、ギャラリー;回廊, I visited a wonderful gallery of modern art in New York., 私はニューヨークですばらしい現代美術館を訪れた。
1165, , fame, 名声, He worked for fame, not for the sake of his family., 彼は家族のためではなく、名声のために働いた。
1166, , deadline, 締め切り, Be sure to submit your report before the deadline., 必ず締め切り前に報告書を提出するように。
1167, , undergraduate, 学部学生, As an undergraduate, he studied English grammar., 学部学生のとき彼は英文法を研究した。
1168, , slavery, 奴隷制度;苦役, Even before Lincoln, some politicians had tried to abolish slavery., リンカーン以前にも、中には奴隷制度を廃止することを試みた政治家もいた。
1169, , prey, 獲物;犠牲者, Many types of animals hunt prey for food., たくさんの種類の動物が食べるために獲物を狩る。
1170, , mess, 散らかった状態［物］;混乱状態, My parents had me clean up the mess in the living room., 私の両親は私に居間の散らかった物を片付けさせた。
1171, , recession, 不況;後退, Our country has not recovered from the economic recession yet., 我が国は経済不況からまだ回復していない。
1172, , retreat, 後退、退却;（計画・決定などの）撤回, The military were forced to make a retreat from the enemy., 軍隊は敵陣から退却することを余儀なくされた。
1173, , grave, 墓;（the ～）死, Every time she returns home, she visits her grandmother's grave., 故郷に戻るたびに彼女は祖母の墓にお参りする。
1174, , column, コラム;（新聞などの）欄;円柱;（縦）列, She writes a newspaper column once a week., 彼女は週に1回新聞のコラムを書いている。
1175, , scenery, （集合的に）景色;背景, They had lunch on the balcony, with a view of the mountain scenery., 彼らは山の景色の展望がきくバルコニーで昼食をとった。
1176, , plot, （小説などの）筋;陰謀, The plot of this detective novel is too complicated to understand., この探偵小説の筋は複雑すぎて理解できない。
1177, , sculpture, 彫刻（作品）, You can see Michelangelo's famous sculpture in St. Peter's in Vatican City., バチカン市国のサンピエトロ大聖堂ではミケランジェロの有名な彫刻を見ることができる。
1178, , tablet, タブレット（型情報端末）;錠剤;平板, Some think that it is more convenient to read novels on a tablet., タブレットで小説を読むほうが便利だと考える人がいる。
1179, 形容詞, dense, 密集した、密度の高い;（霧などが）濃い, We had trouble walking through a dense crowd of people., 私たちは密集した人混みの中を通り抜けるのに苦労した。
1180, , exotic, 外来の;異国風の, The zoo has an exhibition of rare and exotic animals., その動物園は珍しい外来の動物を公開している。
1181, , acid, 酸性の;酸っぱい;辛辣な, It is not certain that acid rain is caused by air pollution., 酸性雨が大気汚染によって引き起こされるのかはっきりしない。
1182, , bitter, 苦い、つらい;辛辣な;怒りっぽい, He had the bitter experience of fighting in the war., 彼は戦争で戦うというつらい経験をした。
1183, , sensible, 賢明な;実用的な;顕著な, She made the sensible decision of consulting her lawer., 彼女は弁護士に相談するという賢明な判断をした。
1184, , noble, 高貴な;堂々とした;高潔な, He married a woman of a noble family., 彼は高貴な家系の女性と結婚した。
1185, , vague, 漠然とした、あいまいな;おぼろげな, I have a vague memory of my conversation with her on the phone., 私は彼女と電話で話をしたという漠然とした記憶がある。
1186, , parallel, （～と）平行［並行］の;類似した, She drove on a road that is parallel to the main road., 彼女は本街道と並行している道路を車で運転した。
1187, , tense, 張り詰めた、緊張した, The goal of this exercise is to relax tense muscles and reduce stress., この運動の目的は緊張した筋肉をほぐし、ストレスを減らすことである。
1188, , vertical, 垂直の;縦方向の, She placed the ladder in a vertical position., 彼女ははしごを垂直の位置に置いた。
1189, , indigenous, 原産の、先住の;（その土地に）固有の, Pumpkins are vegetables indigenous in Central America., カボチャは中央アメリカ原産の野菜である。
1190, , aboriginal, （通例A～）アボリジニの;原生の、先住の, Aboriginal art varies across the regions of Australia., アボリジニの芸術はオーストラリア国内の地域によりさまざまである。
1191, , seasonal, 季節の、季節的な, Seasonal discounts have become common in the fashion industry., 季節割引はファッション業界では一般的になっている。
1192, , abundant, 豊富な;（～に）富む（in）, Thanks to his abundant talents, he succeeded as an entertainer., 豊かな才能のおかげで彼は芸能人として成功した。
1193, , hybrid, ハイブリッドの;雑種の;混成の, Those who drive hybrid cars get the privilege of free parking here., ハイブリッド車は運転する人はここで無料駐車の特権を得る。
1194, , irrelevant, （～にとって）無関係の（to）;見当違いの, He asked the teacher a question irrelevant to the topic., 彼は先生にその話題に無関係の質問をした。
1195, , ridiculous, ばかげた;法外な, The reporter asked him a ridiculous question at the press conference., その記者は記者会見で彼にばかげた質問をした。
1196, , fairy, 妖精の（ような）, The queen in that fairy tale was so cruel to Snow White., そのおとぎ話に出てくる女王は白雪姫にひどく冷酷だった。
1197, , sensory, 感覚の, Sensory information travels throughout the nervous system., 感覚の情報は神経系のすみずみまで伝わる。
1198, , chronic, 慢性の;長引く;常習の, Healthy life habits can reduce the risk of chronic diseases., 健康的な生活習慣は、慢性疾患の危険性を減らす可能性がある。
1199, , voluntary, 自発的な;無償の, People often act on the basis of their voluntary will., 人々はよく自らの自発的意思に基づいて行動する。
1200, , inclined, 傾向がある;傾いた, She is inclined to be very optimistic about her future., 彼女は自分の将来についてとても楽観的な傾向がある。
1201, 動詞, infer, を推論する、推測する, I inferred that her hometown is London from her words., 私は彼女の言葉から彼女の故郷がロンドンであると推測した。
1202, , esteem, を尊敬する;を見なす, He is highly esteemed as a genious in mathematics., 彼は数学の天才として大いに尊敬されている。
1203, , tackle, に取り組む;と（～のことで）話をつける, We mmust find an effective way to tackle this task., 私たちはこの任務に取り組むための効果的な方法を見つけなければならない。
1204, , venture, 危険を冒して進む;を思い切ってする, The company ventured into an unknown territory., その会社は危険を冒して未知の分野に乗り出した。
1205, , accelerate, を加速させる、促進する;加速する, The new goal of the government is to accelerate economic growth., 政府の新しい目標は経済成長を加速させることである。
1206, , accustom, （人）を慣れさせる, I am accustomed to hearing criticism from the media., 私はマスコミからの批判を聞くのに慣れている。
1207, , amuse, を面白がらせる、楽しませる, His jokes and funny stories amused us., 彼の冗談や滑稽な話は私たちを面白がらせた。
1208, , flourish, 繁栄する;繁茂する;を振りかざす, Renaissance art flourished in Italy between the 14th and 16th century., ルネサンス芸術は14世紀から16世紀にかけてイタリアで繁栄した。
1209, , thrive, 繁栄する、うまくいく;繁茂する, The local economy is thriving after the new factory was built., 新しい工場が建設された後、地元の経済は反映している。
1210, , nurture, をはぐくむ;を養成する, She nurtured her talents by painting and writing poems., 彼女は絵を描いたり詩を書いたりして自分の才能をはぐくんだ。
1211, , click, （を）クリックする;をカチッと鳴らす;カチッと音がする, To download the file, you need to click on the filename on the screen., ファイルをダウンロードするには、画面上のファイル名をクリックする必要がある。
1212, , spin, 回転する;を回転させる;（糸）を紡ぐ, The earth is spinning around on its axis., 地球は地軸を中心に回転している。
1213, , clip, を切り抜く;を（はさみで）切り取る; をクリップで留める, She clips suitable articles from the newspaper for future use., 彼女は将来使うために新聞から適当な記事を切り抜く。
1214, , drag, を引きずる;ぐずぐずする, I saw people dragging big bags at the airport., 私は空港で人々が大きなバッグを引きずっているのを見た。
1215, , cast, を投じる;に役を当てる, His repeated mistakes forced us to cast doubt on his ability., 彼の度重なる失敗のせいで、私たちは彼の能力に疑問を投げかけざるを得なかった。
1216, , scatter, をまき散らす;分散する, There is litter scattered on the beach., 海岸にごみがまき散らされている。
1217, , tempt, を（～する）気にさせる（to do）;を引き付ける, Manufacturers may be tempted to ignore the consumers' complaints., 製造業者は消費者の苦情を無視したくなることもある。
1218, , withdraw, を引き出す;を撤回する;撤退する, She withdrew 20,000 yen from the ATM at a convenience store., 彼女はコンビニのATMから20000円引き出した。
1219, , yawn, あくびをする, I noticed that he was trying hard not to yawn during class., 私は彼が授業中必死にあくびをしないようにしているのに気付いた。
1220, , blink, まばたきする;点滅する;（目）をまたたく, He has a habit of blinking whenever he gives a speech., 彼は演説するときはいつもまばたきをする癖がある。
1221, , dye, を染める;染まる, The woman decided to dye her hair brown., その女性は髪を茶色に染めることにした。
1222, , spill, をこぼす;こぼれる, She accidentally spilled red wine on her white dress., 彼女は誤って自分の白いドレスに赤ワインをこぼした。
1223, , irritate, をいらいらさせる;をひりひりさせる, Jason's loud voice irritates her., ジェイソンの大声は彼女をいらいらさせる。
1224, , insult, を侮辱する, He insulted me by suggesting that I cheated in the exam.,彼は私が試験でカンニングしたとほのめかして私を侮辱した。
1225, , enforce, を施行［実施］する;を（～に）強制する, The police enforce laws which the government has made., 警察は政府が作った法律を実施する。
1226, , rob, から（金品を）奪う, Three men robbed a woman of her wallet on a crowded train., 3人の男が混雑した電車の中で女性から財布を奪った。
1227, , drain, （液体）を流出させる;（液体が）流れ出る, She forgot to drain water from the bathtub., 彼女は浴槽から水を流すのを忘れた。
1228, , suspend, を停職［停学、出場停止］にする;を一時的に中断する, The athlete has been suspended for not following the rules., その運動選手は規則を守らなかったために出場停止になっている。
1229, , drift, 漂う;さまよう;を押し流す, The sailboat slowly drifted in the sea., 帆船はゆっくりと海の上を漂った。
1230, , forgive, を許す;を免除する, Please forgive me for having kept you waiting for such a long time., こんなにも長い間あなたをお待たせしたことを許してください。
1231, , revise, を修正する;を改訂する, I need to revise my essay draft by next Monday., 私は次の月曜日までに小論文の草稿を修正する必要がある。
1232, , recruit, を募る;に新人を補充する, Some colleges spend a lot of money to recruit talented students., 才能のある学生を募るために多額の金を使う大学もある。
1233, , twist, をねじる、ひねる;を歪曲する, While playing tennis, I twisted my ankle., テニスをしていて、私は足首をひねった。
1234, , crush, を押しつぶし;を弾圧する;を絞り出す, Every morning, commuters in Tokyo are crushed on trains., 毎朝、東京の通勤者は列車の中で押しつぶされる。
1235, , pin, をピンで留める;を突き刺す, She pinned a note onto the bulletin board., 彼女は掲示板にメモをピンで留めた。
1236, , uncover, を暴く;を発掘する, The magazine uncovered the actor's secret., 雑誌はその俳優の秘密を暴いた。
1237, , exploit, を活用する;を搾取する、につけ込む, I do not think my company is fully exploiting its human resources., 私は会社が人的資源を十分に活用しているとは思わない。
1238, , implement, を実行［実施］する, Japan implemented its recycling policy in 1991., 日本は1991年にそのリサイクル政策を実施した。
1239, , integrate, を統合する;融合する, The students integrated the ideas from their teacher with their own., 生徒たちは教師からのアイディアと自分たちのアイディアを統合した。
1240, , incorporate, を取り入れる;を法人にする;合併する, Many words have been incorporated into English from Latin and French., 多くの語がラテン語やフランス語から英語に取り入れられてきた。
1241, 名詞, profile, 人物の紹介;横顔;輪郭, The reporter was told to write a profile of the new mayor., 記者は新市長の人物紹介を書くように言われた。
1242, , appetite, 食欲;欲求, People tend to have a bigger appetite when they feel a lot of stress., 大きなストレスを感じると、人は食欲が増す傾向にある。
1243, , impulse, 衝動;刺激, She could not resist the impulse to eat ice cream., 彼女はアイスクリームを食べたいという衝動に抵抗できなかった。
1244, , script, 台本;筆跡, The directory insisted that the actors memorize the script., 監督は俳優たちが台本を暗記することを要求した。
1245, , anniversary, （～周年）記念日, The celebrated their fifth wedding anniversary last Sunday., 彼らはこの前の日曜日に結婚5周年を祝った。
1246, , pension, 年金, She started to receive her retirement pension at the age of 65., 彼女は65歳で退職者年金を受け取り始めた。
1247, , temper, 気質、気性;機嫌;かんしゃく, Her temper is sweet and calm, so everyone likes her., 彼女の気性は優しくて穏やかなので、だれもが彼女のことを好きである。
1248, , cortex, 皮質;樹皮, The frontal cortex is the most recently evolved part of the brain., 前頭皮質は脳の中で最も遅くに進化した部分である。
1249, , syndrome, 症候群; ～現象, Inborn heart defects are associated with many genetics syndromes., 生まれつきの心臓欠陥は多くの遺伝的症候群と関連付けられる。
1250, , chamber, （特定の目的の）部屋;議場;（the ～）議院, The guide took me through the chambers of the castle., ガイドは私を連れて城の部屋を案内した。
1251, , utility, 公共事業;公共料金;実用性, Free markets may be replaced with publicly owned utilities someday., 自由市場はいつか公営公共事業に取って代わられるかもしれない。
1252, , cattle, （集合的に）牛, He raises cattle and pigs at the foot of the mountain., 彼はその山のふもとで牛と豚を飼育している。
1253, , herd, （牛などの）群れ;群衆, A large herd of elephants have moved into the fields., ゾウの大きな群れが野原に移動した。
1254, , fluid, 流動体、液体, The patient is only allowed to drink fulids today., その患者は今日は水分をとることだけが許可されている。
1255, , pity, 残念なこと;哀れみ, It is a great pity that you have to leave so quickly., あなたがこんなにも早く出発しなければならないとはとても残念です。
1256, , priest, 聖職者, He became a Christian priest and a professor at Cambridge University., 彼はキリスト今日の聖職者になり、ケンブリッジ大学の教授になった。
1257, , acquaintance, 知人;面識;知識, She is just a casual acquaintance., 彼女はただのちょっとした知り合いだ。
1258, 